name,id,portal_name,street,street2,zipcode,city,state,county,country,lat,lon,type,description,url,phone,email,archived,status,activityName,activityCnt,role,contactNames,contactEmails,courses,sectionCnt,unitNames,unitCnt,externalId,programs
M S D Warren Township,a721cfa2-8765-433c-6cbe-a84711251b58,Indianapolis,975 North Post Road,,46219,Indianapolis,IN,Marion County,US,39.78152,-86.00865,education: k-12,,https://www.warren.k12.in.us/,,,False,approved,"['Kids College', 'iDEW: Computing by Design Summer Workshop']",1,"{""Promote event to target populations"",""Provide access to target populations""},{""Provide access to target populations"",""Provide information materials""}","['', ' ']","['', '']",,1,"['Office of Workforce and Community Engagement', 'Robert H. McKinney School of Law', 'Luddy School of Informatics, Computing, and Engineering', 'School of Nursing', 'Herron School of Art and Design', 'Richard M. Fairbanks School of Public Health']",1,5360,"['IUI 2030 Strategic Plan Pillar 3, Goal 2: P-12 Education']"
M S D Warren Township: Warren Central High School,13f360ea-5391-40f0-4d29-08d2a151bdd1,Indianapolis,9500 E 16th St,,46229,Indianapolis,IN,Marion,US,39.791291,-86.000001,education: k-12,,http://wchs.warren.k12.in.us/,(317) 532-6200,,False,approved,"['Education Counseling Internship: Warren Central High School', 'Special Programs for Academic Nurturing (SPAN)', 'TRIO Upward Bound', 'iDEW: Computing by Design Summer Workshop']",1,"{""Provide access to target populations""},{""Provide access to target populations"",""Provide information materials""},{""Discuss how to work together"",""Evaluate or provide feedback on students' work"",""Supervise students""},{""Provide access to target populations""}","[' ', ' ', ' ', ' ']","['', '', '', '']","['EDUC-G550-20875', 'EDUC-G550-Spring 2025 - Fall 2025']",1,"['Luddy School of Informatics, Computing, and Engineering', 'University College', 'School of Education', 'University College', 'Special Programs for Academic Nurturing']",1,5360-5361,"['IUI 2030 Strategic Plan Pillar 3, Goal 2: P-12 Education']"
M S D Washington Township Schools,2cf8bb11-05e0-4c76-4899-e8815d27aacc,Indianapolis,8500 Woodfield Crossing Blvd.,,46240,Indianapolis,IN,Marion,US,39.910768,-86.121244,education: k-12,"The Metropolitan School District of Washington Township (MSDWT) is located in the northern section of Indianapolis, Indiana and Marion County. It is a dynamic community with broad diversity in cultures, religions, ethnic groups, races and socioeconomic levels. Washington Township has been an educational leader in Indiana for the last sixty years and offers a comprehensive educational curriculum with special activities and programs geared to provide enrichment, exploration, and instructional support for students.",http://www.msdwt.k12.in.us/,(317) 845-9400,,False,approved,['B235 Community Clinicals'],1,"{""Identify areas of need"",""Identify expected measures, benefits, or outcomes"",""Co-educate students"",""Discuss how to work together"",""Evaluate or provide feedback on students' work"",""Manage the event or activity"",""Supervise students""}",[' '],[''],['NURS-B235-All Spring Sections'],1,['NURS: Science of Nursing Care'],1,5370,"['IUI 2030 Strategic Plan Pillar 3, Goal 4: Health Service Outcomes']"
M S D Washington Township: North Central High School,4fd94f4f-ec7e-4a98-4517-cc88da38d6bc,Indianapolis,1801 E. 86th St.,,46240,Indianapolis,IN,Marion,US,39.911177,-86.129048,education: k-12,"North Central High School is a public high school in Indianapolis, Indiana, United States. It is part of the Metropolitan School District of Washington Township. North Central is an International Baccalaureate school.",http://www.nchs.cc/,(317) 259-5301,,False,approved,['Special Programs for Academic Nurturing (SPAN)'],1,"{""Provide access to target populations""}",[' '],[''],,1,"['University College', 'Special Programs for Academic Nurturing']",1,5370-5451,"['IUI 2030 Strategic Plan Pillar 3, Goal 2: P-12 Education']"
M S D Washington Township: Westlane Middle School,290f5290-43a0-41bd-63c4-463e306cff79,Indianapolis,1301 W 73rd St,,46260,Indianapolis,IN,Marion,US,39.885138,-86.182259,education: k-12,,http://www.msdwt.k12.in.us/wl/,(317) 259-5412,,False,approved,['Secondary Education Field Experience: Westlane Middle School'],1,"{""Co-educate students"",""Evaluate or provide feedback on students' work"",""Supervise students""}",[' '],[''],"['EDUC-M403-Unknown', 'EDUC-M451-22435']",1,['School of Education'],1,5370-5448,"['IUI 2030 Strategic Plan Pillar 3, Goal 2: P-12 Education']"
M S D Wayne Township,d763ec3f-2667-48fc-6d03-e320e115f9eb,Indianapolis,1220 S High Sch Rd,,46241-3199,Indianapolis,IN,Marion,US,39.749653,-86.27029,education: k-12,,http://www.wayne.k12.in.us/,(317) 988-8600,,False,approved,['Kids College'],1,"{""Promote event to target populations"",""Provide access to target populations""}",[''],[''],,1,"['Herron School of Art and Design', 'Richard M. Fairbanks School of Public Health', 'Office of Workforce and Community Engagement', 'Robert H. McKinney School of Law', 'School of Nursing']",1,5375,"['IUI 2030 Strategic Plan Pillar 3, Goal 2: P-12 Education']"
M S D Wayne Township: Ben Davis Ninth Grade Center,e38d546f-90e7-4d77-6880-711b545a76fb,Indianapolis,1150 N Girls School Rd,,46214,Indianapolis,IN,Marion,US,39.782959,-86.292135,education: k-12,,http://www.wayne.k12.in.us/bdfresh/,(317) 988-7500,,False,approved,['Special Programs for Academic Nurturing (SPAN)'],1,"{""Promote event to target populations"",""Provide access to target populations""}",[' '],[''],,1,"['Special Programs for Academic Nurturing', 'University College']",1,5375-5219,"['IUI 2030 Strategic Plan Pillar 3, Goal 2: P-12 Education']"
M S D Wayne Township: Ben Davis University High School,f161236d-6a5e-4f29-5325-ae13f50d46f2,Indianapolis,1155 S High School Rd,,46241,Indianapolis,IN,Marion,US,39.751995,-86.267825,education: k-12,,http://www.wayne.k12.in.us/bduhs/,(317) 988-7800,,False,approved,['Special Programs for Academic Nurturing (SPAN)'],1,"{""Provide access to target populations""}",[' '],[''],,1,"['University College', 'Special Programs for Academic Nurturing']",1,5375-5447,"['IUI 2030 Strategic Plan Pillar 3, Goal 2: P-12 Education']"
M S D Wayne Township: Chapel Hill 7th & 8th Grade Center,8c5bc82a-9cfd-4753-5de2-b19f19ff6693,Indianapolis,7320 W 10th St,,46214,Indianapolis,IN,Marion,US,39.780127,-86.290939,education: k-12,,http://www.wayne.k12.in.us/chapelhill/,(318) 988-8800,,False,approved,"['Elementary Education Field Placement With Chapel Hill 7th & 8th Grade Center', 'iDEW: Computing by Design Summer Workshop']",1,"{""Provide access to target populations"",""Provide information materials""},{""Co-educate students"",""Evaluate or provide feedback on students' work"",""Supervise students""}","[' ', ' ']","['', '']","['EDUC-E328-20857', 'EDUC-E340-20859', 'EDUC-E343-20863', 'EDUC-E345-20745', 'EDUC-H440-23928', 'EDUC-M301-20774', 'EDUC-M304-20776', 'EDUC-M305-20898', 'EDUC-M306-20900', 'EDUC-M320-20780']",1,"['Luddy School of Informatics, Computing, and Engineering', 'School of Education']",1,5375-5221,"['IUI 2030 Strategic Plan Pillar 3, Goal 2: P-12 Education']"
M S D Wayne Township: Lynhurst 7th & 8th Grade Center,be4b2c7c-7578-4019-7565-13bef3f96fc2,Indianapolis,2805 S Lynhurst,,46241,Indianapolis,IN,Marion,US,39.724911,-86.24562,education: k-12,,http://www.wayne.k12.in.us/lynhurst/,(317) 988-8100,,False,approved,['Elementary Education Field Placement With MSD Wayne Township: Lynhurst 7th & 8th Grade Center'],1,"{""Identify areas of need"",""Identify expected measures, benefits, or outcomes"",""Co-educate students"",""Discuss how to work together"",""Evaluate or provide feedback on students' work"",""Evaluate or provide feedback on the process or relationship of the partners"",""Manage the event or activity"",""Provide access to target populations"",""Supervise students""}",[' '],[''],"['EDUC-E340-22388', 'EDUC-E343-22392', 'EDUC-H440-25291', 'EDUC-M301-22421', 'EDUC-M304-22423', 'EDUC-M324-25509', 'EDUC-M324-25565']",1,['School of Education'],1,5375-5222,"['IUI 2030 Strategic Plan Pillar 3, Goal 2: P-12 Education']"
M S D Wayne Township: Maplewood Elementary School,f2ec6be6-706b-4c47-5ed9-7568021aa4bf,Indianapolis,1643 Dunlap Ave,,46241,Indianapolis,IN,Marion,US,39.74408,-86.24367,education: k-12,,http://www.wayne.k12.in.us/mwe/,(317) 988-6600,,False,approved,['Student Teaching with MSD Wayne Township: Maplewood Elementary'],1,"{""Identify areas of need"",""Identify expected measures, benefits, or outcomes"",""Co-educate students"",""Discuss how to work together"",""Evaluate or provide feedback on students' work"",""Evaluate or provide feedback on the process or relationship of the partners"",""Manage the event or activity"",""Provide access to target populations"",""Supervise students""}",[' '],[''],"['EDUC-M470-20917', 'EDUC-M482-20921', 'EDUC-X425-20933']",1,['School of Education'],1,5375-5223,"['IUI 2030 Strategic Plan Pillar 3, Goal 2: P-12 Education']"
M S D Wayne Township: Stout Field Elementary School,cc4176e0-5ec0-4d5c-7100-ce7bf4f8dc34,Indianapolis,3820 W Bradbury,,46241,Indianapolis,IN,Marion,US,39.732133,-86.22646,education: k-12,,http://www.wayne.k12.in.us/sfe,(317) 988-6800,,False,approved,['Secondary Education Field Experience: Stout Field Elementary'],1,"{""Identify areas of need"",""Identify expected measures, benefits, or outcomes"",""Co-educate students"",""Discuss how to work together"",""Evaluate or provide feedback on students' work"",""Evaluate or provide feedback on the process or relationship of the partners"",""Supervise students""}",[' '],[''],"['EDUC-M403-Unknown', 'EDUC-M451-22435']",1,['School of Education'],1,5375-5270,"['IUI 2030 Strategic Plan Pillar 3, Goal 2: P-12 Education']"
M S D of Decatur Township,3fb7f344-784a-42b5-745b-09b55fe1c76b,Indianapolis,5275 Kentucky Ave,,46221,Indianapolis,IN,Marion County,US,39.686457,-86.277082,education: k-12,,https://www.decaturproud.org/updates,,,False,approved,['Kids College'],1,"{""Promote event to target populations"",""Provide access to target populations""}",[''],[''],,1,"['Robert H. McKinney School of Law', 'School of Nursing', 'Office of Workforce and Community Engagement', 'Richard M. Fairbanks School of Public Health', 'Herron School of Art and Design']",1,5300,"['IUI 2030 Strategic Plan Pillar 3, Goal 2: P-12 Education']"
MSD Pike Township: Nathaniel Jones Early Childhood Center,fe84b627-1236-41c0-7465-d812033f3fd9,Indianapolis,7839 New Augusta Road,,46268,Indianapolis,18,Marion County,US,39.89594,-86.23555,education: k-12,,,,,False,approved,"['Project CELEBRATE: Cultivating Equitable Learning Environments, Building Readiness, Advancing Teacher Education grantled Activity']",1,,[''],[''],,1,['School of Education'],1,None,"['IUI 2030 Strategic Plan Pillar 3, Goal 2: P-12 Education']"
MSD Wayne Township: Ben Davis High School,7f47a523-c8cd-49ca-6117-94a063c65ef1,Indianapolis,1200 N Girls School Rd,,46214,Indianapolis,IN,Marion,US,39.784032,-86.290947,education: k-12,"The mission of Ben Davis High School, a partnership of students, staff, families, and community, is to ensure that all students acquire and apply knowledge, skills, processes and values to become lifelong learners and productive citizens in a diverse society through an innovative educational program of outstanding quality.",http://bdhs.wayne.k12.in.us/,(317) 988-7000,,False,approved,"['Secondary Education Field Experience: Ben Davis High School', 'iDEW: Computing by Design Summer Workshop']",1,"{""Identify areas of need"",""Identify expected measures, benefits, or outcomes"",""Co-educate students"",""Discuss how to work together"",""Evaluate or provide feedback on students' work"",""Evaluate or provide feedback on the process or relationship of the partners"",""Supervise students""},{""Provide access to target populations"",""Provide information materials""}","[' ', ' ']","['', '']","['EDUC-M403-Unknown', 'EDUC-M451-22435']",1,"['School of Education', 'Luddy School of Informatics, Computing, and Engineering']",1,5375-5213,"['IUI 2030 Strategic Plan Pillar 3, Goal 2: P-12 Education']"
MSD of PIke Township,6847cd89-b389-4ee3-697b-bee4fe1ba664,Indianapolis,6901 Zionsville Rd,,46268,Indianapolis,IN,Marion,US,39.87872,-86.25905,education: k-12,,https://www.pike.k12.in.us/,317-293-0393,,False,approved,['Kids College'],1,"{""Promote event to target populations"",""Provide access to target populations""}",[''],[''],,1,"['Herron School of Art and Design', 'Richard M. Fairbanks School of Public Health', 'Office of Workforce and Community Engagement', 'Robert H. McKinney School of Law', 'School of Nursing']",1,5350,"['IUI 2030 Strategic Plan Pillar 3, Goal 2: P-12 Education']"
Marion County Public Health Department,a7801e11-788d-4707-5ebc-7a502f848b41,Indianapolis,3838 N. Rural St.,,46205.0,Indianapolis,IN,Marion,US,39.82654,-86.11726,government,"The Marion County Public Health Department is dedicated to help the residents of Marion County achieve and maintain an optimal level of wellness. The Health Department and its partners are committed to embracing and promoting diversity throughout our programs. We are at work 24 hours a day, 7 days a week to keep the residents of Indianapolis safe.",http://marionhealth.org/,(317) 221-2000,HealthDept@MarionHealth.org,False,approved,"['Diabetes Impact Project - Indianapolis Neighborhoods (DIP-IN)', 'Limiting Overdose through Collaborative Actions in Localities', 'Marion County Public Health Department Plan to Strengthen Infrastructure, Workforce, and Data Systems', 'Marion County School Liaison Support', 'Nursing Clinical Experiences: Community-Based']",2,"{""Identify areas of need"",""Set goals"",""Negotiate costs and logistics"",""Identify expected measures, benefits, or outcomes"",""Assist in raising funds for the activity"",""Co-educate students"",""Discuss how to work together"",""Evaluate or provide feedback on students' work"",""Evaluate or provide feedback on the process or relationship of the partners"",""Manage the event or activity"",""Measure the impact of the activity on the community"",""Promote event to target populations"",""Provide access to data"",""Provide access to target populations"",""Provide funds for the activity"",""Provide information materials"",""Provide volunteer site or space"",""Supervise the activity""}, {""Identify areas of need"",""Set goals"",""Negotiate costs and logistics"",""Identify expected measures, benefits, or outcomes"",""Assist in raising funds for the activity"",""Co-educate students"",""Discuss how to work together"",""Evaluate or provide feedback on students' work"",""Evaluate or provide feedback on the process or relationship of the partners"",""Manage the event or activity"",""Measure the impact of the activity on the community"",""Promote event to target populations"",""Provide access to data"",""Provide access to target populations"",""Provide funds for the activity"",""Provide information materials"",""Provide volunteer site or space"",""Supervise the activity""},{Co-investigator,""Discuss how to work together""},{""Co-educate students"",""Discuss how to work together"",""Manage the event or activity"",""Provide access to target populations"",""Supervise students""},{Co-investigator}, {""Identify expected measures, benefits, or outcomes"",""Co-educate students"",""Discuss how to work together"",""Evaluate or provide feedback on the process or relationship of the partners"",""Measure the impact of the activity on the community"",""Provide access to data"",""Provide access to target populations""}","[' ', ' ', ' ', ' '], [' '], ['Ebony Funches']","['', '', '', ''], [''], ['efunches@marionhealth.org']",,1,"['Richard M. Fairbanks School of Public Health'], ['School of Nursing', 'Richard M. Fairbanks School of Public Health', 'Richard M. Fairbanks School of Public Health', 'Richard M. Fairbanks School of Public Health']",2,None,"['IUI 2030 Strategic Plan Pillar 3, Goal 1: Workforce Development', 'IUI 2030 Strategic Plan Pillar 3, Goal 2: P-12 Education', 'IUI 2030 Strategic Plan Pillar 3, Goal 4: Health Service Outcomes']"
Marion County Public Health Department Watch me Grow,64ffb122-3e49-400f-7dc3-fbe89507ee1d,Indianapolis,3435 W 30th St,,46222,Indianapolis,18,Marion County,US,39.80946,-86.21796,government,After school program,,,,False,approved,['B235 Community Clinicals'],1,"{""Identify areas of need"",""Identify expected measures, benefits, or outcomes"",""Co-educate students"",""Evaluate or provide feedback on students' work"",""Manage the event or activity"",""Measure the impact of the activity on the community"",""Supervise the activity"",""Supervise students""}",[' '],[''],['NURS-B235-All Spring Sections'],1,['NURS: Science of Nursing Care'],1,None,"['IUI 2030 Strategic Plan Pillar 3, Goal 4: Health Service Outcomes']"
Mary Rigg Neighborhood Center,cb937769-ec08-4ecd-42c3-2c35623067e9,Indianapolis,1920 W Morris St,,46221,Indianapolis,IN,,US,39.751261,-86.195101,nonprofit,To empower individuals by serving as a resource for help and hope.,http://www.maryrigg.org/,,,False,approved,['SEAL Indiana'],1,"{""Provide access to target populations"",""Provide volunteer site or space""}",[' '],[''],,1,"['Center for Service and Learning', 'School of Dentistry', 'IUSD: Department of Cariology, Operative Dentistry, and Dental Public Health']",1,None,"['IUI 2030 Strategic Plan Pillar 3, Goal 4: Health Service Outcomes']"
Methodist Hospital,fe11280a-6bc7-4caa-4c44-bb59c4ad37dd,Indianapolis,250 West 16th Street,,46202,Indianapolis,IN,,US,39.788331,-86.162233,nonprofit,,,,,False,approved,"['H356 Nursing Clinical', 'L430 Nursing Clinical']",1,"{""Identify areas of need"",""Set goals"",""Identify expected measures, benefits, or outcomes"",""Co-educate students"",""Discuss how to work together"",""Evaluate or provide feedback on students' work"",""Evaluate or provide feedback on the process or relationship of the partners"",""Manage the event or activity"",""Measure the impact of the activity on the community"",""Promote event to target populations"",""Provide access to data"",""Provide access to target populations"",""Provide information materials"",""Provide volunteer site or space"",""Supervise the activity"",""Supervise students""},{""Identify areas of need"",""Set goals"",""Identify expected measures, benefits, or outcomes"",""Co-educate students"",""Discuss how to work together"",""Evaluate or provide feedback on students' work"",""Evaluate or provide feedback on the process or relationship of the partners"",""Manage the event or activity"",""Measure the impact of the activity on the community"",""Promote event to target populations"",""Provide access to data"",""Provide access to target populations"",""Provide information materials"",""Provide volunteer site or space"",""Supervise the activity"",""Supervise students""}","[' ', ' ']","['', '']","['NURS-H356-All Sections', 'NURS-L430-All Sections']",1,"['School of Nursing', 'School of Nursing']",1,X00504,"['IUI 2030 Strategic Plan Pillar 3, Goal 4: Health Service Outcomes']"
Metropolitan Indianapolis-Central Indiana Area Health Education Center (MICI-AHEC),905a5df6-dfe7-4630-4653-fe33c92736da,Indianapolis,123 St.,,46227,Indianapolis,IN,,US,39.76436,-86.14898,informal,"The Metropolitan Indianapolis Central Indiana Area Health Education Center (AHEC) plays an important role in providing health care professionals prepared to meet the needs of these counties: Marion, Madison, Johnson, Hancock, Hendricks, Boone, Shelby, Morgan and Hamilton.",http://mici-ahec.uindy.edu/,(317) 788-2001,adamswilsont@uindy.edu,False,approved,['Dr. Camp and Camp M.D.'],1,"{""Assist in raising funds for the activity"",""Discuss how to work together"",""Provide access to target populations""}",['Traci Adams-Wilson'],['adamswilsont@uindy.edu'],,1,"['School of Dentistry', 'School of Medicine']",1,None,"['IUI 2030 Strategic Plan Pillar 3, Goal 2: P-12 Education', 'IUI 2030 Strategic Plan Pillar 3, Goal 4: Health Service Outcomes']"
Mid-States Minority Supplier Development Council,ce5a47a3-4723-4f13-63cd-b3e3dcef619c,Indianapolis,2126 North Meridian Street,,46202,Indianapolis,IN,Marion County,US,39.795833,-86.1577,nonprofit,,https://www.midstatesmsdc.org/,,,False,approved,['Enterprise Corps - Business Accelerator for Central Indiana’s Growth-Oriented Small Businesses'],1,"{""Identify areas of need"",""Identify expected measures, benefits, or outcomes"",""Assist in raising funds for the activity"",""Discuss how to work together"",""Evaluate or provide feedback on the process or relationship of the partners"",""Promote event to target populations"",""Provide access to target populations""}",['Daryle Johnson'],['daryle.johnson@midstatesmsdc.org'],['BUS-XX529-multiple sections'],1,"['Kelley School of Business', 'Indiana Business Research Center']",1,None,"['IUI 2030 Strategic Plan Pillar 3, Goal 3: Economic Development']"
Mill Creek Community Sch Corp: Cascade Senior High School,489b3b5f-dd93-48e6-4eef-d3968bb10b7c,Indianapolis,6565 S CR 200 W,,46118,Clayton,IN,Hendricks,US,39.665809,-86.55906,education: k-12,,http://mccsc.k12.in.us/cascade/index.htm,(317) 539-9315,,False,approved,['Special Programs for Academic Nurturing (SPAN)'],1,"{""Provide access to target populations""}",[' '],[''],,1,"['Special Programs for Academic Nurturing', 'University College']",1,3335-2692,"['IUI 2030 Strategic Plan Pillar 3, Goal 2: P-12 Education']"
Monroe-Gregg School District: Monrovia High School,37913a9c-7e34-4559-6554-457af537d172,Indianapolis,205 S Chestnut St,,46157,Monrovia,IN,Morgan,US,39.575573,-86.478121,education: k-12,,http://www.m-gsd.org/mhs/,(317) 996-2258,,False,approved,['Special Programs for Academic Nurturing (SPAN)'],1,"{""Provide access to target populations""}",[' '],[''],,1,"['University College', 'Special Programs for Academic Nurturing']",1,5900-6321,"['IUI 2030 Strategic Plan Pillar 3, Goal 2: P-12 Education']"
Mooresville Con School Corp: Mooresville High School,6ca14905-94ae-41d8-7276-4f3861956bf1,Indianapolis,550 N Indiana St,,46158,Mooresville,IN,Morgan,US,39.618928,-86.376939,education: k-12,,http://mooresvilleschools.org,(317) 831-9203,,False,approved,['Special Programs for Academic Nurturing (SPAN)'],1,"{""Provide access to target populations""}",[' '],[''],,1,"['University College', 'Special Programs for Academic Nurturing']",1,5930-6369,"['IUI 2030 Strategic Plan Pillar 3, Goal 2: P-12 Education']"
Mt Vernon Community School Corp: Mt Vernon Middle School,8d95e161-5f24-4824-56e0-5e78b248b6b7,Indianapolis,1862 W SR 234,,46040,Fortville,IN,Hancock,US,39.936018,-85.86593,education: k-12,,http://mvms.mvcsc.k12.in.us/,(317) 485-3160,,False,approved,['Education Counseling Practicum: Mount Vernon Middle School'],1,"{""Identify areas of need"",""Identify expected measures, benefits, or outcomes"",""Co-educate students"",""Discuss how to work together"",""Evaluate or provide feedback on students' work"",""Evaluate or provide feedback on the process or relationship of the partners"",""Manage the event or activity"",""Provide access to target populations"",""Supervise students""}",[' '],[''],['EDUC-G524-Spring 2025 - Fall 2025'],1,['School of Education'],1,3135-2559,"['IUI 2030 Strategic Plan Pillar 3, Goal 2: P-12 Education']"
NeuroDiagnostic Institute,662d981f-b667-4990-6489-f03dfe71a54f,Indianapolis,"5435 E 16th St, Indianapolis",,46219,Indianapolis,IN,Marion County,US,39.788233,-86.076415,government,,,,,False,approved,['H360 Nursing Clinical'],1,"{""Identify areas of need"",""Set goals"",""Identify expected measures, benefits, or outcomes"",""Co-educate students"",""Discuss how to work together"",""Evaluate or provide feedback on students' work"",""Evaluate or provide feedback on the process or relationship of the partners"",""Manage the event or activity"",""Measure the impact of the activity on the community"",""Promote event to target populations"",""Provide access to data"",""Provide access to target populations"",""Provide information materials"",""Provide volunteer site or space"",""Supervise the activity"",""Supervise students""}",[' '],[''],['NURS-H360-All Sections'],1,['School of Nursing'],1,None,"['IUI 2030 Strategic Plan Pillar 3, Goal 4: Health Service Outcomes']"
Newfields,b5ac5185-70cf-4222-6cd3-6cacf0e55782,Indianapolis,4000 Michigan Rd.,,46208.0,Indianapolis,IN,Marion,US,39.825628,-86.182511,nonprofit,"Newfields (Indianapolis Museum of Art) is an encyclopedic art museum located in Indianapolis, Indiana, United States.",http://www.imamuseum.org/,,,False,approved,['Central Indiana Wikipedia Partnership'],1,"{""Identify areas of need"",""Identify expected measures, benefits, or outcomes"",""Discuss how to work together"",""Promote event to target populations"",""Provide access to data"",""Provide access to target populations""}",[' '],[''],,1,['IU Indianapolis University Library'],1,None,"['IUI 2030 Strategic Plan Pillar 3, Goal 1: Workforce Development']"
Nineveh-Hensley-Jackson United: Indian Creek Sr High School,e501a249-3469-4ccb-628f-1db7d1330a21,Indianapolis,803 W Indian Creek Dr,,46181,Trafalgar,IN,Johnson,US,39.40733,-86.160681,education: k-12,,http://www.nhj.k12.in.us/ichs/index.htm,(317) 878-2110,,False,approved,['Special Programs for Academic Nurturing (SPAN)'],1,"{""Promote event to target populations"",""Provide access to target populations""}",[' '],[''],,1,"['University College', 'Special Programs for Academic Nurturing']",1,4255-3419,"['IUI 2030 Strategic Plan Pillar 3, Goal 2: P-12 Education']"
