name,id,portal_name,street,street2,zipcode,city,state,county,country,lat,lon,type,description,url,phone,email,archived,status,activityName,activityCnt,role,contactNames,contactEmails,courses,sectionCnt,unitNames,unitCnt,externalId,programs
Indiana Humanities Council,e3f8def1-5754-476a-4c51-23770998126a,Indianapolis,1500 N Delaware St.,,46202.0,Indianapolis,IN,Marion,US,39.78771,-86.15439,nonprofit,"Indiana Humanities connects people, opens minds and enriches lives by creating and facilitating programs that encourage Hoosiers to think, read and talk.",https://indianahumanities.org,(317) 638-1500,,False,approved,['Central Indiana Wikipedia Partnership'],1,"{""Identify areas of need"",""Identify expected measures, benefits, or outcomes"",""Discuss how to work together"",""Promote event to target populations"",""Provide access to data"",""Provide access to target populations""}",[' '],[''],,1,['IU Indianapolis University Library'],1,None,"['IUI 2030 Strategic Plan Pillar 3, Goal 1: Workforce Development']"
Indiana Immunization Coalition,3426dbc5-45c8-42d0-6b33-be5b8098e40b,Indianapolis,12112 Briarway N. Dr.,,46059,Indianapolis,IN,,US,39.680343,-85.949704,government,"The Indiana Immunization Coalition exists to reduce the spread of vaccine-preventable diseases through immunization education, advocacy, promotion, and statewide collaborative partnerships.",http://vaccinateindiana.org/,,,False,approved,['Campuswide HPV Communications'],1,"{""Set goals"",""Provide information materials""}",['NA NA'],['NA@email.com'],,1,"['Richard M. Fairbanks School of Public Health', 'School of Medicine', 'Health and Wellness Promotion', 'SLA: Communication Studies']",1,None,"['IUI 2030 Strategic Plan Pillar 3, Goal 4: Health Service Outcomes']"
Indiana Legal Services,9398755d-a9d5-4808-7a45-b20df6dc899c,Indianapolis,151 North Delaware,,46204,Indianapolis,IN,,US,39.76939,-86.154025,nonprofit,,,,,False,approved,['Indiana University Student Outreach Clinic'],1,"{""Identify areas of need"",""Co-educate students"",""Discuss how to work together"",""Evaluate or provide feedback on students' work"",""Evaluate or provide feedback on the process or relationship of the partners"",""Manage the event or activity"",""Promote event to target populations"",""Provide access to target populations"",""Provide information materials"",""Supervise the activity""}",[' '],[''],['PSY-B110-25468'],1,"['School of Nursing', 'Richard M. Fairbanks School of Public Health', 'School of Dentistry', 'Robert H. McKinney School of Law', 'School of Health and Human Sciences', 'School of Medicine', 'School of Social Work', 'University College']",1,X00368,"['IUI 2030 Strategic Plan Pillar 3, Goal 4: Health Service Outcomes']"
Indiana Minority Health Coalition,45eb83df-8530-4890-432b-487e8457428c,Indianapolis,3737 N. Meridian St.,,46008.0,Indianapolis,IN,,US,39.823481,-86.156375,nonprofit,"To enhance the quality of life through education, advocacy, and quality health care services for racial/ethnic minorities. To conduct research and training, develop policy,and create and maintain a broad-based network of affiliate agencies.",http://www.imhc.org/,,,False,approved,['Black Maternal Health ECHO'],1,"{""Manage the event or activity"",""Promote event to target populations""}",[' '],[''],,1,['Richard M. Fairbanks School of Public Health'],1,None,"['IUI 2030 Strategic Plan Pillar 3, Goal 1: Workforce Development', 'IUI 2030 Strategic Plan Pillar 3, Goal 4: Health Service Outcomes']"
Indiana Public Health Association,e24336ef-1d44-4e96-6066-f1bfd7b0469d,Indianapolis,"English Foundation Building, 615 Alabama St STE 119",,46204.0,Indianapolis,IN,Marion County,US,39.762061,-86.152867,nonprofit,"<p>Typically, these internships are reserved for graduate students, but we will consider undergraduate students on a case-by-case basis. We are also happy to make student connections with our partners based on the students’ specific public health interests and goals. IPHA interns’ tasks vary but are in alignment with our organizations’ overall goals to strengthen public health infrastructure in Indiana, build public health capacity, and advance upstream efforts in the state</p>",https://inpha.org/,3178473286,info@inpha.org,False,approved,['Health Sciences Internships'],1,"{""Identify areas of need"",""Identify expected measures, benefits, or outcomes"",""Co-educate students"",""Discuss how to work together"",""Evaluate or provide feedback on students' work"",""Manage the event or activity"",""Supervise students""}",['Betsy Prentice'],['bprentice@hbdin.org'],['HLSC-H495-Fall 2024-Spring 2025'],1,['School of Health and Human Sciences'],1,None,"['IUI 2030 Strategic Plan Pillar 3, Goal 1: Workforce Development']"
Indiana Rural Health Association,9f1cdd9e-7ffd-4c13-6061-9421c491716e,Indianapolis,1418 N 1000 W.,,47441,Linton,IN,Greene County,US,39.04438,-87.12868,nonprofit,The Indiana Rural Health Association is a not-For-profit organization developed for the purpose of improving the health of Hoosiers living in rural areas. The Indiana Rural Health Association is a member-driven organization composed of a diverse membership.  Our members have intrinsic strengths important to the task of providing meaningful forums. These forums provide opportunities for assessing the strengths and weaknesses of the health care systems; identifying needs and problems within the rural settings; and assessing and developing leadership resources.,https://www.indianaruralhealth.org/,(812) 478-3919,info@indianarha.org,False,approved,"['Copy of Indiana Rural Opioid Consortium - Medication-Assisted Treatment Program', 'Indiana Rural Opioid Consortium - Medication-Assisted Treatment Program']",1,"{""Identify areas of need"",""Co-educate students""},{""Identify areas of need"",""Co-educate students""}","['', ' ']","['', '']",,1,"['Richard M. Fairbanks School of Public Health', 'Richard M. Fairbanks School of Public Health']",1,None,"['IUI 2030 Strategic Plan Pillar 3, Goal 4: Health Service Outcomes']"
Indiana School For The Deaf,61072be8-877e-44f3-4dd2-2f2b855c451e,Indianapolis,1200 E 42nd St,,46205,Indianapolis,IN,Marion,US,39.834179,-86.135125,education: k-12,,http://www.deafhoosiers.com,(317) 550-4800,,False,approved,"['Special Programs for Academic Nurturing (SPAN)', 'iDEW: Computing by Design Summer Workshop']",1,"{""Provide access to target populations""},{""Provide access to target populations"",""Provide information materials""}","[' ', ' ']","['', '']",,1,"['University College', 'Special Programs for Academic Nurturing', 'Luddy School of Informatics, Computing, and Engineering']",1,C695,"['IUI 2030 Strategic Plan Pillar 3, Goal 2: P-12 Education']"
Indiana State Department of Health,0c4bf258-317b-41ba-5b02-24cbdc9f788e,Indianapolis,2 N. Meridian St.,,46204.0,Indianapolis,IN,,US,39.767374,-86.158315,government,The Indiana State Department of Health seeks to promote and provide essential public health services to Indiana.,http://www.in.gov/isdh/,,,False,approved,"['Assessment of Health First Indiana Funding Impact and Program Achievements', 'Health Sciences Internships', 'Indiana Sickle Cell Data Collection Program; Component A', 'Scott County HIV Task Force', 'Strengthening Indiana Families']",2,"{""Identify areas of need"",""Set goals"",""Negotiate costs and logistics"",""Identify expected measures, benefits, or outcomes"",""Discuss how to work together"",""Evaluate or provide feedback on the process or relationship of the partners"",""Provide access to data"",""Provide access to target populations"",""Provide information materials"",""Provide volunteer site or space""},{Co-investigator},{""Provide funds for the activity""},{""Identify areas of need"",""Negotiate costs and logistics"",""Identify expected measures, benefits, or outcomes"",""Co-educate students"",""Discuss how to work together"",""Evaluate or provide feedback on students' work"",""Manage the event or activity"",""Measure the impact of the activity on the community"",""Provide funds for the activity""}, {""Identify areas of need"",""Set goals"",""Provide access to data"",""Provide access to target populations"",""Supervise students""}","[' '], ['Gretchen Martin', ' ', ' ', ' ']","[''], ['GMartin1@isdh.IN.gov', '', '', '']",['HLSC-H495-Fall 2024-Spring 2025'],2,"['Richard M. Fairbanks School of Public Health', 'Richard M. Fairbanks School of Public Health', 'Richard M. Fairbanks School of Public Health', 'School of Social Work', 'School of Medicine'], ['School of Health and Human Sciences']",2,None,"['IUI 2030 Strategic Plan Pillar 3, Goal 1: Workforce Development', 'IUI 2030 Strategic Plan Pillar 3, Goal 4: Health Service Outcomes']"
Indiana State Library,959c3742-c6ac-4a03-56e9-2a74355219ec,Indianapolis,315 W. Ohio St.,,46202.0,Indianapolis,IN,Marion County,US,39.769395,-86.163866,government,,https://www.in.gov/library/,,,False,approved,['Central Indiana Wikipedia Partnership'],1,"{""Identify areas of need"",""Discuss how to work together"",""Promote event to target populations"",""Provide access to data"",""Provide access to target populations""}",[' '],[''],,1,['IU Indianapolis University Library'],1,None,"['IUI 2030 Strategic Plan Pillar 3, Goal 1: Workforce Development']"
Indiana State Personnel Department ,ad2ace18-7513-41f5-4675-a1195d00f421,Indianapolis,402 W Washington St # W161,,46204.0,Indianapolis,IN,Marion County,US,39.767569,-86.166015,government,"<p>Governor’s Summer Interns spend at least 50 percent of their time on a predetermined project that enhances college-level skills and abilities.&nbsp;The internships attract students from many areas of study including engineering, business, communications, finance, agriculture and veterinary science.&nbsp;Look for the internships around as early as february. Typically starting at $13/hr, but may vary on agency and job.</p>",https://www.in.gov/spd/workforindiana/internships/,(317) 232-0200,,False,approved,['Health Sciences Internships'],1,"{""Provide funds for the activity""}",[' '],[''],['HLSC-H495-Fall 2024-Spring 2025'],1,['School of Health and Human Sciences'],1,None,"['IUI 2030 Strategic Plan Pillar 3, Goal 1: Workforce Development']"
Indianapolis Metropolitan High School,f3036ba2-dd92-4556-6935-9705959ef290,Indianapolis,1635 W Michigan St,,46222,Indianapolis,IN,Marion,US,39.773693,-86.191711,education: k-12,,,,,False,approved,"['IU Student Success Corps (In Person)', 'Special Programs for Academic Nurturing (SPAN)', 'iDEW: Computing by Design Summer Workshop']",1,"{""Provide access to target populations""},{""Provide access to target populations"",""Provide information materials"",""Supervise the activity""},{""Identify areas of need"",""Identify expected measures, benefits, or outcomes"",""Discuss how to work together"",""Evaluate or provide feedback on students' work"",""Evaluate or provide feedback on the process or relationship of the partners"",""Promote event to target populations"",""Provide access to data"",""Provide access to target populations"",""Provide volunteer site or space""}","[' ', ' ', ' ']","['', '', '']",,1,"['Luddy School of Informatics, Computing, and Engineering', 'Office of Workforce and Community Engagement', 'Family, School, and Neighborhood Engagement', 'Special Programs for Academic Nurturing', 'University College']",1,5664,"['IUI 2030 Strategic Plan Pillar 3, Goal 2: P-12 Education']"
Indianapolis Muslim Community Association,4bbefbe9-ebd6-4d58-6d1a-c6c2857250ff,Indianapolis,"2846 Cold Spring Rd, Indianapolis, IN 46222",,46222,Indianapolis,IN,Marion County,US,39.75099,-86.19674,religious,"<p>At IMCA, we believe that serving our community is a profound act of worship. From supporting our members to uplifting the broader society, our programs are designed to reflect the principles of faith, hope, and charity. Join us in making a difference.</p>",https://imcaindy.org,"3178559934, Sheikh Ahmed Alamine, Executive Director",exec.dir@theimcaonline.org,False,approved,['Communication for Whole Health'],1,"{""Identify areas of need"",""Set goals"",""Negotiate costs and logistics"",""Identify expected measures, benefits, or outcomes"",""Assist in raising funds for the activity"",""Co-educate students"",Co-investigator,""Discuss how to work together"",""Evaluate or provide feedback on the process or relationship of the partners"",""Manage the event or activity"",""Measure the impact of the activity on the community"",""Promote event to target populations"",""Provide access to data"",""Provide access to target populations"",""Provide funds for the activity"",""Provide information materials"",""Provide volunteer site or space"",""Supervise the activity""}",['Ahmed Alamine'],['exec.dir@theimcaonline.org'],,1,"['School of Liberal Arts', 'SLA: Communication Studies']",1,None,"['IUI 2030 Strategic Plan Pillar 3, Goal 4: Health Service Outcomes']"
Indianapolis Public Library,4a59e432-2613-4b10-649e-c0942efbcd90,Indianapolis,40 E. St. Clair St.,,46204.0,Indianapolis,IN,,US,39.778471,-86.156768,government,"The Indianapolis Public Library is the public library system serving the citizens of Marion County, Indiana.",http://www.indypl.org/,,,False,approved,['Central Indiana Wikipedia Partnership'],1,"{""Identify areas of need"",""Identify expected measures, benefits, or outcomes"",""Discuss how to work together"",""Promote event to target populations"",""Provide access to data"",""Provide access to target populations""}",[' '],[''],,1,['IU Indianapolis University Library'],1,None,"['IUI 2030 Strategic Plan Pillar 3, Goal 1: Workforce Development']"
Indianapolis Public Schools,9858654b-3edf-4c2e-4098-de4e950838ea,Indianapolis,120 E Walnut St,,46204-1389,Indianapolis,IN,Marion,US,39.777291,-86.154584,education: k-12,,http://www.myips.org,(317) 226-4411,,False,approved,"['Career Coaching Grant - IUI', 'Kids College', 'Minority Engineering Advancement Program (MEAP)', 'Nursing Clinical Experiences: Community-Based', 'SEAL Indiana', 'VidaSana']",1,"{""Co-educate students"",""Discuss how to work together"",""Manage the event or activity"",""Provide access to target populations"",""Provide volunteer site or space""},{""Identify areas of need"",""Identify expected measures, benefits, or outcomes"",""Discuss how to work together"",""Manage the event or activity"",""Promote event to target populations"",""Provide access to data"",""Provide access to target populations"",""Provide volunteer site or space""},{""Provide access to target populations"",""Provide volunteer site or space""}, {""Co-educate students"",""Manage the event or activity"",""Provide access to target populations"",""Provide volunteer site or space"",""Supervise the activity"",""Supervise students""},{""Promote event to target populations"",""Provide access to target populations""},{""Promote event to target populations"",""Provide access to target populations""}","[' ', ' ', ' '], [' ', '', ' ']","['', '', '']",,1,"['School of Dentistry', 'IUSD: Department of Cariology, Operative Dentistry, and Dental Public Health', 'Center for Service and Learning', 'Richard M. Fairbanks School of Public Health', 'School of Dentistry', 'VidaSana', 'School of Nursing'], ['School of Engineering and Technology', 'Career Services', 'Herron School of Art and Design', 'School of Nursing', 'Robert H. McKinney School of Law', 'Office of Workforce and Community Engagement', 'Richard M. Fairbanks School of Public Health']",2,5385,"['IUI 2030 Strategic Plan Pillar 3, Goal 2: P-12 Education', 'IUI 2030 Strategic Plan Pillar 3, Goal 4: Health Service Outcomes']"
Indianapolis Public Schools: Anna Brochhausen School 88,5dea61f4-a5bc-4cd1-4376-cb17c725d0f1,Indianapolis,5801 E 16th St,,46218,Indianapolis,IN,Marion,US,39.78781,-86.06847,education: k-12,,http://www.88.ips.k12.in.us/,(317) 226-4288,,False,approved,['Scripps National Spelling Bee'],1,"{""Evaluate or provide feedback on students' work"",""Manage the event or activity"",""Promote event to target populations"",""Provide access to target populations"",""Provide information materials"",""Supervise the activity"",""Supervise students""}",[' '],[''],,1,"['School of Education', 'School of Liberal Arts', 'Division of Student Affairs']",1,5385-5588,"['IUI 2030 Strategic Plan Pillar 3, Goal 2: P-12 Education']"
Indianapolis Public Schools: Arlington Community Middle School,9bce2b58-12ef-4437-764a-ec8e7e9777ef,Indianapolis,120 E Walnut St,,46204,Indianapolis,IN,Marion,US,39.777291,-86.154584,education: k-12,,http://www.myips.org/,(317) 822-7980,,False,approved,"['Career Coaching Grant - IUI', 'College and Career Coaching', 'IU Student Success Corps (In Person)', 'iDEW: Computing by Design Summer Workshop']",1,"{""Co-educate students"",""Manage the event or activity"",""Provide access to target populations"",""Provide volunteer site or space"",""Supervise the activity"",""Supervise students""},{""Identify expected measures, benefits, or outcomes"",""Discuss how to work together"",""Promote event to target populations"",""Provide access to target populations""},{""Provide access to target populations"",""Provide information materials""},{""Identify areas of need"",""Identify expected measures, benefits, or outcomes"",""Discuss how to work together"",""Evaluate or provide feedback on students' work"",""Evaluate or provide feedback on the process or relationship of the partners"",""Promote event to target populations"",""Provide access to data"",""Provide access to target populations"",""Provide volunteer site or space""}","[' ', ' ', ' ', ' ']","['', '', '', '']",,1,"['Career Services', 'Office of Workforce and Community Engagement', 'Family, School, and Neighborhood Engagement', 'Office of Workforce and Community Engagement', 'Luddy School of Informatics, Computing, and Engineering']",1,5385-5466,"['IUI 2030 Strategic Plan Pillar 3, Goal 2: P-12 Education']"
Indianapolis Public Schools: Arsenal Technical High School,caeeb74e-d775-449d-4746-bb06bdcc544f,Indianapolis,1500 E Michigan St,,46201.0,Indianapolis,IN,Marion,US,39.775336,-86.132481,education: k-12,,https://schools.myips.org/arsenaltech/,(317) 693-5300,,False,approved,"['Career Coaching Grant - IUI', 'College and Career Coaching', 'IU Student Success Corps (In Person)', 'TRIO Upward Bound', 'iDEW', 'iDEW: Computing by Design Summer Workshop']",2,"{""Co-educate students"",""Manage the event or activity"",""Provide access to target populations"",""Provide volunteer site or space"",""Supervise the activity"",""Supervise students""},{""Identify areas of need"",""Set goals"",""Identify expected measures, benefits, or outcomes"",""Co-educate students"",""Discuss how to work together"",""Evaluate or provide feedback on students' work"",""Evaluate or provide feedback on the process or relationship of the partners"",""Manage the event or activity"",""Promote event to target populations"",""Provide access to target populations""},{""Identify expected measures, benefits, or outcomes"",""Discuss how to work together"",""Promote event to target populations"",""Provide access to target populations""},{""Provide access to target populations"",""Provide information materials""},{""Provide access to target populations""},{""Identify areas of need"",""Identify expected measures, benefits, or outcomes"",""Discuss how to work together"",""Evaluate or provide feedback on students' work"",""Evaluate or provide feedback on the process or relationship of the partners"",""Promote event to target populations"",""Provide access to data"",""Provide access to target populations"",""Provide volunteer site or space""}, {""Identify areas of need"",""Set goals"",""Identify expected measures, benefits, or outcomes"",""Co-educate students"",""Discuss how to work together"",""Evaluate or provide feedback on students' work"",""Evaluate or provide feedback on the process or relationship of the partners"",""Manage the event or activity"",""Promote event to target populations"",""Provide access to target populations""}","[' ', ' ', ' ', ' ', ' ', ' '], [' ']","['', '', '', '', '', ''], ['']",,1,"['Luddy School of Informatics, Computing, and Engineering'], ['Office of Workforce and Community Engagement', 'Office of Workforce and Community Engagement', 'Family, School, and Neighborhood Engagement', 'Luddy School of Informatics, Computing, and Engineering', 'Career Services', 'Luddy School of Informatics, Computing, and Engineering', 'University College']",2,5385-5462,"['IUI 2030 Strategic Plan Pillar 3, Goal 1: Workforce Development', 'IUI 2030 Strategic Plan Pillar 3, Goal 2: P-12 Education']"
Indianapolis Public Schools: Broad Ripple Middle School,2a5ed91e-db9a-4ac4-4028-f3a3b94256c1,Indianapolis,1115 Broad Ripple Avenue,,46220,Indianapolis,IN,Marion County,US,39.8687,-86.137422,education: k-12,,,,,False,approved,['College and Career Coaching'],1,"{""Identify expected measures, benefits, or outcomes"",""Discuss how to work together"",""Promote event to target populations"",""Provide access to target populations""}",[' '],[''],,1,['Office of Workforce and Community Engagement'],1,None,"['IUI 2030 Strategic Plan Pillar 3, Goal 2: P-12 Education']"
Indianapolis Public Schools: Center For Inquiry School 2,ae84c95e-5757-41dd-46ab-174ca15b0c1c,Indianapolis,725 N New Jersey St,,46202,Indianapolis,IN,Marion,US,39.7772,-86.150065,education: k-12,,http://www.myips.org/cfi2,(317) 226-4202,,False,approved,['Scripps National Spelling Bee'],1,"{""Evaluate or provide feedback on students' work"",""Manage the event or activity"",""Promote event to target populations"",""Provide access to target populations"",""Provide information materials"",""Supervise the activity"",""Supervise students""}",[' '],[''],,1,"['School of Liberal Arts', 'School of Education', 'Division of Student Affairs']",1,5385-5635,"['IUI 2030 Strategic Plan Pillar 3, Goal 2: P-12 Education']"
Indianapolis Public Schools: Charles Warren Fairbanks Sch 105,3652e468-c4a1-4c42-5d6f-d3091d2adaeb,Indianapolis,8620 Montery Rd,,46226,Indianapolis,IN,Marion,US,39.831182,-86.016276,education: k-12,,http://www.105.ips.k12.in.us/,(317) 226-4105,,False,approved,['Scripps National Spelling Bee'],1,"{""Evaluate or provide feedback on students' work"",""Manage the event or activity"",""Promote event to target populations"",""Provide access to target populations"",""Provide information materials"",""Supervise the activity"",""Supervise students""}",[' '],[''],,1,"['School of Education', 'School of Liberal Arts', 'Division of Student Affairs']",1,5385-5605,"['IUI 2030 Strategic Plan Pillar 3, Goal 2: P-12 Education']"
Indianapolis Public Schools: Christian Park School 82,972c8a84-fe78-440c-706a-63817f84fe0e,Indianapolis,4700 English Ave,,46201,Indianapolis,IN,Marion,US,39.76065,-86.089359,education: k-12,,http://www.82.ips.k12.in.us/,(317) 226-4282,,False,approved,"['Education Counseling Internship: Christian Park School 82', 'Scripps National Spelling Bee']",1,"{""Identify areas of need"",""Identify expected measures, benefits, or outcomes"",""Co-educate students"",""Discuss how to work together"",""Evaluate or provide feedback on students' work"",""Evaluate or provide feedback on the process or relationship of the partners"",""Manage the event or activity"",""Provide access to target populations"",""Supervise students""},{""Evaluate or provide feedback on students' work"",""Manage the event or activity"",""Promote event to target populations"",""Provide access to target populations"",""Provide information materials"",""Supervise the activity"",""Supervise students""}","[' ', ' ']","['', '']",['EDUC-G550-20875'],1,"['School of Liberal Arts', 'School of Education', 'School of Education', 'Division of Student Affairs']",1,5385-5582,"['IUI 2030 Strategic Plan Pillar 3, Goal 2: P-12 Education']"
Indianapolis Public Schools: Clarence Farrington School 61,680aa626-b1c9-41f4-5ab3-312898f480ae,Indianapolis,4326 Patricia St,,46222,Indianapolis,IN,Marion,US,39.810826,-86.23387,education: k-12,,http://www.61.ips.k12.in.us/,(317) 226-4261,,False,approved,['Elementary Education Field Placement With Clarence Farrington Elementary School'],1,"{""Co-educate students"",""Evaluate or provide feedback on students' work"",""Supervise students""}",[' '],[''],"['EDUC-E328-20857', 'EDUC-E340-20859', 'EDUC-E343-20863', 'EDUC-E345-20745', 'EDUC-H440-23928', 'EDUC-M301-20774', 'EDUC-M304-20776', 'EDUC-M305-20898', 'EDUC-M306-20900', 'EDUC-M320-20780']",1,['School of Education'],1,5385-5662,"['IUI 2030 Strategic Plan Pillar 3, Goal 2: P-12 Education']"
